{
  "formatVersion": 1,
  "id": "org.em3k.system.sample-france",
  "version": "1.0.0",
  "title": "Discovering France",
  "description": "An introductory course about France's geography, landmarks, and culture.",
  "publisherId": "em3k-system",
  "language": "en-US",
  "license": "CC-BY-4.0",
  "tags": ["geography", "beginner"],
  "lessons": [
    {
      "id": "france-overview",
      "title": "An Introduction to France",
      "file": "lessons/france-overview.json"
    }
  ]
}